[
  {
    "id": "wcag22",
    "source_name": "WCAG 2.2",
    "url": "https://www.w3.org/TR/WCAG22/",
    "product_studio": "W3C",
    "platform": [
      "web"
    ],
    "screen_flow": "Success criteria and conformance",
    "pattern_category": "accessibility",
    "categories": [
      "standards",
      "web-patterns"
    ],
    "authority_class": "standard",
    "why_reference_matters": "Normative baseline for web accessibility decisions.",
    "qualities_to_study": [
      "Keyboard, focus, target sizing, contrast and reflow criteria"
    ],
    "interaction_principles": [
      "Interaction must satisfy applicable keyboard and focus criteria."
    ],
    "visual_principles": [
      "Text and meaningful non-text content need the applicable contrast."
    ],
    "ux_principles": [
      "Conformance requires evaluating the complete scope, not judging aesthetics."
    ],
    "do_not_copy": [
      "Do not replace criteria with a generic accessibility score."
    ],
    "adaptation_to_current_system": "Evaluate existing system roles and interactions against applicable AA criteria; repair conflicts through approved semantic roles.",
    "reviewed_date": "2026-10-08",
    "checked_date": "2026-10-08",
    "status": "reviewed",
    "evidence_limits": "Specification inspected; no product or runtime conformance tested."
  },
  {
    "id": "apg-combobox",
    "source_name": "ARIA APG Combobox",
    "url": "https://www.w3.org/WAI/ARIA/apg/patterns/combobox/",
    "product_studio": "W3C WAI",
    "platform": [
      "web"
    ],
    "screen_flow": "Combobox semantics and keyboard model",
    "pattern_category": "selection",
    "categories": [
      "interaction-patterns",
      "web-patterns"
    ],
    "authority_class": "interaction-documentation",
    "why_reference_matters": "Clarifies behavior beyond drawing a dropdown.",
    "qualities_to_study": [
      "Editable versus select-only models"
    ],
    "interaction_principles": [
      "Specify keyboard and focus behavior for the chosen model."
    ],
    "visual_principles": [],
    "ux_principles": [
      "An accessible interaction contract includes semantics and naming."
    ],
    "do_not_copy": [
      "Do not add ARIA to replace suitable native controls without need."
    ],
    "adaptation_to_current_system": "Map the selected model onto the existing control API; validate its real implementation.",
    "reviewed_date": "2026-10-08",
    "checked_date": "2026-10-08",
    "status": "reviewed",
    "evidence_limits": "Pattern document inspected; examples do not prove custom implementation accessibility."
  },
  {
    "id": "apg-dialog",
    "source_name": "ARIA APG Modal Dialog",
    "url": "https://www.w3.org/WAI/ARIA/apg/patterns/dialog-modal/",
    "product_studio": "W3C WAI",
    "platform": [
      "web"
    ],
    "screen_flow": "Modal dialog focus and dismissal",
    "pattern_category": "overlays",
    "categories": [
      "interaction-patterns",
      "web-patterns"
    ],
    "authority_class": "interaction-documentation",
    "why_reference_matters": "Separates modality from overlay position.",
    "qualities_to_study": [
      "Focus entry, containment and restoration"
    ],
    "interaction_principles": [
      "Modal behavior includes managed focus and an exit path."
    ],
    "visual_principles": [],
    "ux_principles": [
      "Preserve task continuity after dismissal."
    ],
    "do_not_copy": [
      "Do not apply modal semantics to a nonmodal comparison panel."
    ],
    "adaptation_to_current_system": "Specify focus entry/return and escape behavior using the existing dialog component.",
    "reviewed_date": "2026-10-08",
    "checked_date": "2026-10-08",
    "status": "reviewed",
    "evidence_limits": "Pattern document inspected; focus behavior needs browser and assistive-technology testing."
  },
  {
    "id": "figma-components",
    "source_name": "Figma components",
    "url": "https://help.figma.com/hc/en-us/articles/360038662654-Guide-to-components-in-Figma",
    "product_studio": "Figma",
    "platform": [
      "Figma"
    ],
    "screen_flow": "Reusable main components and instances",
    "pattern_category": "component architecture",
    "categories": [
      "design-system-references"
    ],
    "authority_class": "design-system-documentation",
    "why_reference_matters": "Grounds reuse in actual Figma mechanisms.",
    "qualities_to_study": [
      "Reusable components and instances"
    ],
    "interaction_principles": [],
    "visual_principles": [
      "Reuse the appropriate component rather than recreating its appearance."
    ],
    "ux_principles": [],
    "do_not_copy": [
      "Do not detach instances just to restyle them."
    ],
    "adaptation_to_current_system": "Inspect existing library assets and preserve component references before extending them.",
    "reviewed_date": "2026-10-08",
    "checked_date": "2026-10-08",
    "status": "reviewed",
    "evidence_limits": "Documentation inspected; no user's Figma file was provided or mutated."
  },
  {
    "id": "figma-properties",
    "source_name": "Figma component properties",
    "url": "https://help.figma.com/hc/en-us/articles/5579474826519-Explore-component-properties",
    "product_studio": "Figma",
    "platform": [
      "Figma"
    ],
    "screen_flow": "Property types and controls",
    "pattern_category": "component API",
    "categories": [
      "design-system-references"
    ],
    "authority_class": "design-system-documentation",
    "why_reference_matters": "Provides configuration mechanisms beyond multiplying variants.",
    "qualities_to_study": [
      "Text, visibility, instance swap, variant and slot properties"
    ],
    "interaction_principles": [
      "Boolean layer visibility can affect prototype structure; inspect behavior."
    ],
    "visual_principles": [
      "Use properties matching editable content and configuration."
    ],
    "ux_principles": [
      "Expose meaningful controls to component consumers."
    ],
    "do_not_copy": [
      "Do not assume every tool or file supports every documented property."
    ],
    "adaptation_to_current_system": "Align properties with implementation concepts and confirm supported capabilities.",
    "reviewed_date": "2026-10-08",
    "checked_date": "2026-10-08",
    "status": "reviewed",
    "evidence_limits": "Documentation inspected including current property table; tool support and actual component bindings untested."
  },
  {
    "id": "figma-variables",
    "source_name": "Figma variables",
    "url": "https://help.figma.com/hc/en-us/articles/15339657135383-Guide-to-variables-in-Figma",
    "product_studio": "Figma",
    "platform": [
      "Figma"
    ],
    "screen_flow": "Variables, collections and modes",
    "pattern_category": "tokens",
    "categories": [
      "design-system-references"
    ],
    "authority_class": "design-system-documentation",
    "why_reference_matters": "Clarifies typed values and scalable configuration.",
    "qualities_to_study": [
      "Collections, modes and aliases"
    ],
    "interaction_principles": [],
    "visual_principles": [
      "Bind supported properties to existing semantic variables."
    ],
    "ux_principles": [],
    "do_not_copy": [
      "Do not force composite styles into a single unsupported variable."
    ],
    "adaptation_to_current_system": "Keep stable variable IDs; map semantic roles and inspect mode values.",
    "reviewed_date": "2026-10-08",
    "checked_date": "2026-10-08",
    "status": "reviewed",
    "evidence_limits": "Documentation inspected; project bindings and library publishing are untested."
  },
  {
    "id": "apple-hig",
    "source_name": "Apple HIG accessibility",
    "url": "https://developer.apple.com/tutorials/data/design/human-interface-guidelines/accessibility.json",
    "product_studio": "Apple",
    "platform": [
      "iOS",
      "iPadOS",
      "macOS"
    ],
    "screen_flow": "Accessibility: text scaling, input alternatives, labeling and motion",
    "pattern_category": "platform behavior",
    "categories": [
      "mobile-patterns",
      "interaction-patterns"
    ],
    "authority_class": "platform-guidance",
    "why_reference_matters": "First-party accessibility guidance for Apple platform design.",
    "qualities_to_study": [
      "Dynamic Type and input alternatives",
      "Labels, control geometry and motion preferences"
    ],
    "interaction_principles": [
      "Offer alternatives to gestures and test platform assistive input.",
      "Preserve system keyboard behavior and reduce unwanted motion."
    ],
    "visual_principles": [
      "Support larger text and meaningful non-color cues."
    ],
    "ux_principles": [
      "Allow user preferences and avoid timed dismissal of necessary information."
    ],
    "do_not_copy": [
      "Do not apply a single platform metric to every OS or interpret guidance as a complete app test."
    ],
    "adaptation_to_current_system": "Use existing native components and project roles, then verify the target platform's accessibility settings and current controls.",
    "reviewed_date": "2026-10-08",
    "checked_date": "2026-10-08",
    "status": "reviewed",
    "evidence_limits": "Landing page was a JavaScript shell. Substantive first-party DocC accessibility JSON was inspected; other HIG topics, rendered examples and an app were not tested."
  },
  {
    "id": "carbon-table",
    "source_name": "Carbon data table guidelines",
    "url": "https://www.carbondesignsystem.com/building-blocks/core/components/data-table/guidelines",
    "product_studio": "IBM Carbon",
    "platform": [
      "web"
    ],
    "screen_flow": "Table anatomy, selection and batch actions",
    "pattern_category": "enterprise data",
    "categories": [
      "dashboard-patterns",
      "interaction-patterns",
      "design-system-references"
    ],
    "authority_class": "design-system-documentation",